{
  "$schema": "./scripts/preflight/security.schema.json",
  "version": 1,
  "pretty": "auto",
  "parallel": true,
  "output": "auto",
  "baselineTolerancePct": 30,
  "toolsDir": ".tools",
  "tools": {
    "gitleaks": {
      "probe": "gitleaks version",
      "install": "node scripts/preflight/install-gitleaks.mjs",
      "version": "8.30.1",
      "sha256": {
        "linux-x64": "551f6fc83ea457d62a0d98237cbad105af8d557003051f41f3e7ca7b3f2470eb",
        "linux-arm64": "e4a487ee7ccd7d3a7f7ec08567610aa3606637dab9242103b3aee62570fb4b080",
        "darwin-x64": "dfe101a4db2255fc85120ac7f3d25e4342c3c20cf749f2c20a18081af1952709",
        "darwin-arm64": "b40ab0ae55c505963e365f271a8d3846efbc170aa17f2607f13df610a9aeb6a5",
        "windows-x64": "d29144deff3a68aa93ced33dddf84b7fdc26070add4aa0f4513094c8332afc4e",
        "windows-arm64": "b95f5e4f5c425cedca7ee203d9afd29597e693c4924a12ed42f970537c72cc0f"
      }
    }
  },
  "precommit": {
    "fix": ["{bin:prettier} --write ."]
  },
  "checks": {
    "secrets": {
      "label": "Secret scan · working tree",
      "group": "check",
      "command": "node scripts/preflight/gitleaks-tree.mjs",
      "tools": ["gitleaks"],
      "enabled": true,
      "skipNext": false,
      "aliases": []
    },
    "secrets-history": {
      "label": "Secret scan · git history",
      "group": "check",
      "command": "gitleaks git . --redact --no-banner -v --config scripts/preflight/gitleaks.toml",
      "tools": ["gitleaks"],
      "enabled": true,
      "skipNext": false,
      "aliases": []
    },
    "boundaries": {
      "label": "Module boundaries",
      "group": "check",
      "command": "node scripts/checks/check-boundaries.mjs",
      "enabled": true,
      "skipNext": false,
      "aliases": [],
      "tools": []
    },
    "typecheck": {
      "label": "Type check",
      "group": "check",
      "command": "{bin:tsc} --noEmit",
      "aliases": ["types"],
      "enabled": true,
      "skipNext": false,
      "tools": []
    },
    "lint": {
      "label": "Lint",
      "group": "check",
      "command": "{bin:eslint} .",
      "enabled": true,
      "skipNext": false,
      "aliases": [],
      "tools": []
    },
    "format": {
      "label": "Format check",
      "group": "check",
      "command": "{bin:prettier} --check .",
      "aliases": ["format:check"],
      "enabled": true,
      "skipNext": false,
      "tools": []
    },
    "test": {
      "label": "Unit tests",
      "group": "check",
      "command": "node --test --test-isolation=none tests/*/*.test.mjs",
      "enabled": true,
      "skipNext": false,
      "aliases": [],
      "tools": []
    },
    "build-ui": {
      "label": "Build React UI",
      "group": "build",
      "command": "{bin:vite} build",
      "aliases": ["build:ui"],
      "enabled": true,
      "skipNext": false,
      "tools": []
    },
    "build-ui": {
      "label": "Build React UI",
      "group": "build",
      "command": "{bin:vite} build",
      "aliases": ["build:ui"],
      "enabled": true,
      "skipNext": false,
      "tools": []
    }
  },
  "baselines": {
    "recordedAt": "2026-10-09T00:37:30.081Z",
    "seconds": {
      "secrets": 2.1,
      "secrets-history": 2.1,
      "boundaries": 2.1,
      "typecheck": 9.6,
      "test": 18.4,
      "build-ui": 2,
      "lint": 6.8,
      "format": 8.4
    }
  }
}
